{
  "$schema": "https://json-schema.org/draft/2020-12/schema",
  "$id": "https://vibe-coding.local/schemas/loop-event.schema.json",
  "title": "Loop Audit Event",
  "type": "object",
  "additionalProperties": false,
  "required": [
    "schema_version",
    "runtime_id",
    "event_id",
    "sequence",
    "event",
    "outcome",
    "actor",
    "request_id",
    "baseline_generation",
    "before_revision",
    "after_revision",
    "from",
    "to",
    "evidence_ids",
    "message",
    "occurred_at"
  ],
  "properties": {
    "schema_version": {
      "const": "1.0.0"
    },
    "runtime_id": {
      "type": "string",
      "pattern": "^loop-[A-Za-z0-9._-]+$"
    },
    "event_id": {
      "type": "string",
      "minLength": 1
    },
    "sequence": {
      "type": "integer",
      "minimum": 1
    },
    "event": {
      "enum": [
        "transition_committed",
        "transition_rejected",
        "warning_issued",
        "hook_blocked",
        "human_decision",
        "journal_reconciled",
        "planning_phase_migrated",
        "milestone_refreshed"
      ]
    },
    "outcome": {
      "enum": ["committed", "rejected", "warning", "blocked", "reconciled", "migrated", "refreshed"]
    },
    "actor": {
      "type": "object",
      "additionalProperties": false,
      "required": ["type", "id"],
      "properties": {
        "type": {
          "enum": [
            "user",
            "orchestrator",
            "agent",
            "hook",
            "system"
          ]
        },
        "id": {
          "type": "string",
          "minLength": 1
        }
      }
    },
    "request_id": {
      "type": "string",
      "minLength": 1
    },
    "idempotency_key": {
      "type": "string",
      "minLength": 1
    },
    "baseline_generation": {
      "type": "integer",
      "minimum": 1
    },
    "before_revision": {
      "type": "integer",
      "minimum": 0
    },
    "after_revision": {
      "type": "integer",
      "minimum": 0
    },
    "transition_id": {
      "type": ["string", "null"]
    },
    "gate_id": {
      "type": "string",
      "minLength": 1
    },
    "gate_fingerprint": {
      "type": "string",
      "minLength": 1
    },
    "producer_responsibility": {
      "type": "string",
      "minLength": 1
    },
    "from": {
      "$ref": "#/$defs/cursor"
    },
    "to": {
      "$ref": "#/$defs/cursor"
    },
    "guard_results": {
      "type": "array",
      "items": {
        "$ref": "#/$defs/result"
      }
    },
    "action_results": {
      "type": "array",
      "items": {
        "$ref": "#/$defs/result"
      }
    },
    "evidence_ids": {
      "type": "array",
      "uniqueItems": true,
      "items": {
        "type": "string"
      }
    },
    "message": {
      "type": "string",
      "minLength": 1
    },
    "occurred_at": {
      "type": "string",
      "pattern": "^\\d{4}-\\d{2}-\\d{2}T\\d{2}:\\d{2}:\\d{2}(?:\\.\\d+)?Z$"
    }
  },
  "allOf": [
    {
      "if": {
        "properties": {
          "event": { "const": "transition_committed" }
        },
        "required": ["event"]
      },
      "then": {
        "required": [
          "transition_id",
          "gate_id",
          "gate_fingerprint",
          "producer_responsibility",
          "guard_results",
          "action_results"
        ]
      }
    },
    {
      "if": {
        "properties": {
          "event": { "const": "journal_reconciled" }
        },
        "required": ["event"]
      },
      "then": {
        "required": ["transition_id", "guard_results", "action_results"]
      }
    }
  ],
  "$defs": {
    "cursor": {
      "type": ["object", "null"],
      "properties": {
        "state": {
          "type": "string"
        },
        "phase": {
          "type": ["string", "null"]
        }
      },
      "required": ["state", "phase"],
      "additionalProperties": false
    },
    "result": {
      "type": "object",
      "additionalProperties": false,
      "required": ["id", "result", "detail"],
      "properties": {
        "id": {
          "type": "string",
          "minLength": 1
        },
        "result": {
          "enum": ["pass", "fail", "skipped", "committed", "reused", "not_run"]
        },
        "detail": {
          "type": "string"
        }
      }
    }
  }
}
